{
  "schema_version": 1,
  "revision": 1,
  "title": "Что я понял: перенос насосной станции",
  "goal": "Перенести НС-2 в осях 4-5 без остановки контура ГВС; выдать ВОР и спецификацию.",
  "review_state": "draft",
  "understanding": [
    {
      "id": "u1",
      "tag": "П1",
      "title": "Контур ГВС остаётся под давлением",
      "detail": "Отключение допускается только на врезку, ночное окно 2 часа.",
      "source_ids": ["s1"]
    }
  ],
  "assumptions": [
    {
      "id": "a1",
      "tag": "Д1 · проверь",
      "title": "Существующие опоры пригодны для новой трассы",
      "detail": "По фото — состояние удовлетворительное; расчёт не выполнялся.",
      "source_ids": ["s2"]
    }
  ],
  "gaps": [
    {
      "id": "g1",
      "tag": "Пр1",
      "title": "Нет отметки врезки в осях 4-5",
      "detail": "Нужен обмер по месту либо разрез из АР."
    }
  ],
  "decisions": [
    {
      "id": "d1",
      "title": "Трасса по существующей эстакаде",
      "ref": "DECISIONS.md#D-001"
    }
  ],
  "sources": [
    { "id": "s1", "kind": "file", "ref": "FACTS.md", "locator": "раздел «Контур ГВС»" },
    { "id": "s2", "kind": "file", "ref": "исходники/фото-опор.pdf", "locator": "листы 3-5" }
  ],
  "next_step": {
    "id": "n1",
    "title": "Сверка карты с инженером",
    "detail": "После подтверждения — обмер врезки и ВОР."
  },
  "analysis_flow": [
    { "n": "Ш1", "title": "Прочитан FACTS.md и ТЗ" },
    { "n": "Ш2", "title": "Найден пробел по отметке врезки", "turn": true }
  ],
  "architecture": [
    { "ln": "слой 1", "title": "Насосная группа", "detail": "2 рабочих + 1 резервный" }
  ]
}
